{"$id":"QK_GBFP8_HEAD64_GRANULARITY_SWEEP_EXECUTION_V17_EXACTLY_ONCE_FRESH_L2_ACCEPTANCE_SCHEMA","$schema":"https://json-schema.org/draft/2020-12/schema","additionalProperties":false,"properties":{"acceptance_sha256":{"pattern":"^[0-9a-f]{64}$","type":"string"},"accepted":{"const":true},"action_id":{"const":"ace2:qk-gbfp8-base-v17:execute-once:4c8a6e31:20260814T102500Z"},"artifact_kind":{"const":"qk_gbfp8_head64_granularity_sweep_execution_v17_exactly_once_fresh_l2_static_acceptance"},"claim_boundary":{"const":"STATIC_ONLY_NO_EXECUTION_AUTHORITY"},"decision":{"const":"ACCEPT_STATIC_PACKAGE"},"execution_package_file_sha256":{"pattern":"^[0-9a-f]{64}$","type":"string"},"fixture_report_sha256":{"pattern":"^[0-9a-f]{64}$","type":"string"},"independent_verifier_file_sha256":{"pattern":"^[0-9a-f]{64}$","type":"string"},"independent_verifier_report_sha256":{"pattern":"^[0-9a-f]{64}$","type":"string"},"official_payload_open_count":{"const":0},"official_target_process_starts":{"const":0},"required_disposition":{"const":"V17_EXACTLY_ONCE_WRAPPER_STATIC_PACKAGE_READY_FOR_FRESH_L2_NO_EXECUTION_AUTHORITY"},"reviewer_role":{"const":"Fresh-L2"},"runtime_namespace_file_count":{"const":0},"static_acceptance_grants_execution_authority":{"const":false},"v17_executed":{"const":false}},"required":["acceptance_sha256","accepted","action_id","artifact_kind","claim_boundary","decision","execution_package_file_sha256","fixture_report_sha256","independent_verifier_file_sha256","independent_verifier_report_sha256","official_payload_open_count","official_target_process_starts","required_disposition","reviewer_role","runtime_namespace_file_count","static_acceptance_grants_execution_authority","v17_executed"],"type":"object"}
