{"acceptance_sha256":"9b97c007f6d0d2a74ffcb50253b7b6428a9c688ea1b6f9a6e735347b70700723","accepted":true,"action_id":"ace2:qk-gbfp8-base-v17:execute-once:4c8a6e31:20260814T102500Z","artifact_kind":"qk_gbfp8_head64_granularity_sweep_execution_v17_exactly_once_fresh_l2_static_acceptance","claim_boundary":"STATIC_ONLY_NO_EXECUTION_AUTHORITY","decision":"ACCEPT_STATIC_PACKAGE","execution_package_file_sha256":"fe2fbaf46ffdd377da8ac0609e4fbc301b7618e660c6be7322add7879b4f62f5","fixture_report_sha256":"18867ffd7b5c37b025b072ab8d25cb4b876b5085758da9395fbad33b970b43cd","independent_verifier_file_sha256":"7f05af21f9be0fe911caf0fa9b9efba1062facfa8b523848599df5afd3d19aad","independent_verifier_report_sha256":"04c776ca797c20a1379ad643dfdb2acd24500f5b4e8bfd277d57349d84e82ee5","official_payload_open_count":0,"official_target_process_starts":0,"required_disposition":"V17_EXACTLY_ONCE_WRAPPER_STATIC_PACKAGE_READY_FOR_FRESH_L2_NO_EXECUTION_AUTHORITY","reviewer_role":"Fresh-L2","runtime_namespace_file_count":0,"static_acceptance_grants_execution_authority":false,"v17_executed":false}
